{
  "$schema": "https://json-schema.org/draft/2020-12/schema",
  "$id": "https://github.com/augentic/specify-cli/schemas/review/workspace-model.schema.json",
  "title": "Specify WorkspaceModel (v1)",
  "description": "Deterministic, versioned snapshot of project facts produced by `specrun review` per RFC-32 §WorkspaceModel. Per RFC-32 §Persistence and query (v1 decision): `.specify/cache/workspace-model.v1.json` is reserved as the future v2 persistence location; `specrun model query <selector>` is reserved as a future read-only CLI verb. v1 ships `--dump-model` only.",
  "type": "object",
  "additionalProperties": false,
  "required": [
    "version",
    "project_dir",
    "scan_profile",
    "artifact_paths",
    "languages",
    "files",
    "frontmatter",
    "markdown_sections",
    "markdown_links",
    "symlinks",
    "skills",
    "adapter_manifests",
    "marketplace_entries",
    "codex_rules",
    "text_matches"
  ],
  "properties": {
    "version": {
      "const": 1,
      "description": "Per RFC-32 §WorkspaceModel — version discriminant. Breaking indexer output bumps the version; v1 pins the shape defined by this schema."
    },
    "project_dir": {
      "type": "string",
      "minLength": 1,
      "description": "Per RFC-32 §WorkspaceModel extraction inputs — scan root (consumer project or framework repo). Typically the project root absolute path; relative `.` is accepted for tests and ephemeral scans."
    },
    "scan_profile": {
      "type": "string",
      "enum": ["consumer", "framework"],
      "description": "Per RFC-32 §WorkspaceModel extraction inputs — controls which extractors run. `consumer` is the only Phase 2 profile; `framework` is reserved for RFC-34."
    },
    "artifact_paths": {
      "type": "array",
      "items": { "$ref": "#/$defs/relativePath" },
      "description": "Per RFC-32 §WorkspaceModel extraction inputs — optional narrow list. Empty array means the indexer performs a full profile-specific scan per §D1."
    },
    "languages": {
      "type": "array",
      "items": {
        "type": "string",
        "minLength": 1
      },
      "description": "Per RFC-32 §WorkspaceModel extraction inputs — optional language tokens supplied by caller or inferred from paths."
    },
    "files": {
      "type": "array",
      "items": { "$ref": "#/$defs/file" },
      "description": "Per RFC-32 §Core entity families (v1) — `file` facts produced by the filesystem walk."
    },
    "frontmatter": {
      "type": "array",
      "items": { "$ref": "#/$defs/frontmatter" },
      "description": "Per RFC-32 §Core entity families (v1) — `frontmatter` facts from markdown `---` block extraction plus YAML parse."
    },
    "markdown_sections": {
      "type": "array",
      "items": { "$ref": "#/$defs/markdownSection" },
      "description": "Per RFC-32 §Core entity families (v1) — `markdown_section` facts from the markdown structure pass."
    },
    "markdown_links": {
      "type": "array",
      "items": { "$ref": "#/$defs/markdownLink" },
      "description": "Per RFC-32 §Core entity families (v1) — `markdown_link` facts from the fence-aware link scan."
    },
    "symlinks": {
      "type": "array",
      "items": { "$ref": "#/$defs/symlink" },
      "description": "Per RFC-32 §Core entity families (v1) — `symlink` facts; recorded but not traversed per §D1."
    },
    "skills": {
      "type": "array",
      "items": { "$ref": "#/$defs/skill" },
      "description": "Per RFC-32 §Core entity families (v1) — `skill` facts from `plugins/**/SKILL.md`."
    },
    "adapter_manifests": {
      "type": "array",
      "items": { "$ref": "#/$defs/adapterManifest" },
      "description": "Per RFC-32 §Core entity families (v1) — `adapter_manifest` facts from `adapters/{sources,targets}/**/adapter.yaml`."
    },
    "marketplace_entries": {
      "type": "array",
      "items": { "$ref": "#/$defs/marketplaceEntry" },
      "description": "Per RFC-32 §Core entity families (v1) — `marketplace_entry` facts from `.cursor-plugin/marketplace.json`."
    },
    "codex_rules": {
      "type": "array",
      "items": { "$ref": "#/$defs/codexRule" },
      "description": "Per RFC-32 §Core entity families (v1) — `codex_rule` facts from codex tree discovery (reuses the RFC-28 parser)."
    },
    "text_matches": {
      "type": "array",
      "items": { "$ref": "#/$defs/textMatch" },
      "description": "Per RFC-32 §Core entity families (v1) — `text_match` facts from the optional precomputed regex index."
    }
  },
  "$defs": {
    "relativePath": {
      "type": "string",
      "minLength": 1,
      "description": "Per RFC-32 §Stability — paths are project-relative with forward slashes."
    },
    "sha256Hex": {
      "type": "string",
      "pattern": "^[0-9a-f]{64}$",
      "description": "Hex-encoded SHA-256 digest (64 lowercase hex characters)."
    },
    "file": {
      "type": "object",
      "additionalProperties": false,
      "required": ["path", "kind"],
      "properties": {
        "path": { "$ref": "#/$defs/relativePath" },
        "kind": {
          "type": "string",
          "enum": ["text", "binary"],
          "description": "Per RFC-32 §D1 — `binary` when the first 8 KiB contains a NUL byte; otherwise `text`."
        },
        "language": {
          "type": "string",
          "minLength": 1,
          "description": "Optional language token inferred from extension or supplied by the caller."
        },
        "sha256": {
          "$ref": "#/$defs/sha256Hex",
          "description": "Optional content digest; populated when extractors need cross-file identity (e.g. `agent_teams` canonical SHA check)."
        }
      }
    },
    "frontmatter": {
      "type": "object",
      "additionalProperties": false,
      "required": ["path", "fields"],
      "properties": {
        "path": { "$ref": "#/$defs/relativePath" },
        "schema-id": {
          "type": "string",
          "minLength": 1,
          "description": "Per RFC-32 §Core entity families (v1) — optional schema id the frontmatter declares (matches the registered-schema token shape from §D3)."
        },
        "fields": {
          "type": "object",
          "description": "Per RFC-32 §Core entity families (v1) — parsed YAML field map. Per-key shape is rule-specific; the model holds the raw value tree.",
          "additionalProperties": true
        }
      }
    },
    "markdownSection": {
      "type": "object",
      "additionalProperties": false,
      "required": ["path", "level", "title", "line-start", "line-end", "body-line-count"],
      "properties": {
        "path": { "$ref": "#/$defs/relativePath" },
        "level": {
          "type": "integer",
          "minimum": 1,
          "maximum": 6,
          "description": "Per RFC-32 §Core entity families (v1) — markdown heading level (1–6)."
        },
        "title": {
          "type": "string",
          "minLength": 1,
          "description": "Heading text after the leading `#`s, with surrounding whitespace trimmed."
        },
        "line-start": {
          "type": "integer",
          "minimum": 1,
          "description": "1-based line of the heading line itself."
        },
        "line-end": {
          "type": "integer",
          "minimum": 1,
          "description": "1-based last line that belongs to this section (the line before the next same-or-higher-level heading, or the file's last line)."
        },
        "body-line-count": {
          "type": "integer",
          "minimum": 0,
          "description": "Per RFC-32 §Core entity families (v1) — number of non-heading body lines under the section."
        }
      }
    },
    "markdownLink": {
      "type": "object",
      "additionalProperties": false,
      "required": ["from-path", "to-raw", "line"],
      "properties": {
        "from-path": {
          "$ref": "#/$defs/relativePath",
          "description": "Per RFC-32 §Core entity families (v1) — path of the markdown file containing the link."
        },
        "to-raw": {
          "type": "string",
          "minLength": 1,
          "description": "Per RFC-32 §Core entity families (v1) — verbatim link target as authored (relative path, URL, or anchor)."
        },
        "line": {
          "type": "integer",
          "minimum": 1,
          "description": "1-based line of the link occurrence."
        },
        "resolves": {
          "type": "boolean",
          "description": "Per RFC-32 §Core entity families (v1) — optional; `true` when the target resolves on disk, `false` for broken/dangling references. Absent for off-tree URLs the indexer did not attempt to resolve."
        }
      }
    },
    "symlink": {
      "type": "object",
      "additionalProperties": false,
      "required": ["path", "target", "broken"],
      "properties": {
        "path": { "$ref": "#/$defs/relativePath" },
        "target": {
          "type": "string",
          "minLength": 1,
          "description": "Per RFC-32 §Core entity families (v1) — symlink target as recorded by the filesystem (may be relative or absolute)."
        },
        "broken": {
          "type": "boolean",
          "description": "Per RFC-32 §Core entity families (v1) — `true` when the link target does not exist on disk."
        }
      }
    },
    "skill": {
      "type": "object",
      "additionalProperties": false,
      "required": ["name", "path", "plugin", "frontmatter-ref"],
      "properties": {
        "name": {
          "type": "string",
          "minLength": 1,
          "description": "Per RFC-32 §Core entity families (v1) — skill name (matches the `name:` frontmatter field)."
        },
        "path": { "$ref": "#/$defs/relativePath" },
        "plugin": {
          "type": "string",
          "minLength": 1,
          "description": "Per RFC-32 §Core entity families (v1) — owning plugin slug (the directory under `plugins/`)."
        },
        "frontmatter-ref": {
          "$ref": "#/$defs/relativePath",
          "description": "Per RFC-32 §Core entity families (v1) — path back to the originating `frontmatter` fact so consumers can join through the frontmatter table."
        }
      }
    },
    "adapterManifest": {
      "type": "object",
      "additionalProperties": false,
      "required": ["axis", "name", "path"],
      "properties": {
        "axis": {
          "type": "string",
          "enum": ["sources", "targets"],
          "description": "Per RFC-32 §Core entity families (v1) — `sources` xor `targets` (the on-disk parent directory under `adapters/`)."
        },
        "name": {
          "type": "string",
          "minLength": 1,
          "description": "Adapter name from `adapter.yaml`."
        },
        "path": { "$ref": "#/$defs/relativePath" },
        "version": {
          "type": "string",
          "minLength": 1,
          "description": "Optional manifest version; absent when the adapter does not pin one."
        }
      }
    },
    "marketplaceEntry": {
      "type": "object",
      "additionalProperties": false,
      "required": ["plugin", "path-in-manifest"],
      "properties": {
        "plugin": {
          "type": "string",
          "minLength": 1,
          "description": "Per RFC-32 §Core entity families (v1) — plugin slug declared by `.cursor-plugin/marketplace.json`."
        },
        "path-in-manifest": {
          "type": "string",
          "minLength": 1,
          "description": "Per RFC-32 §Core entity families (v1) — JSON-pointer-style location inside `marketplace.json` where the entry was discovered."
        }
      }
    },
    "codexRule": {
      "type": "object",
      "additionalProperties": false,
      "required": ["rule-id", "path", "origin", "frontmatter-ref"],
      "properties": {
        "rule-id": {
          "type": "string",
          "minLength": 1,
          "description": "Per RFC-32 §Core entity families (v1) — codex rule id (matches the RFC-28 codex-rule schema's `id` regex)."
        },
        "path": { "$ref": "#/$defs/relativePath" },
        "origin": {
          "type": "string",
          "enum": ["target", "source", "shared", "organization"],
          "description": "Per RFC-32 §Core entity families (v1) — which codex tree contributed the rule (target adapter, source adapter, shared universal tree, or organization-local overlay)."
        },
        "frontmatter-ref": {
          "$ref": "#/$defs/relativePath",
          "description": "Per RFC-32 §Core entity families (v1) — path back to the originating `frontmatter` fact so consumers can join through the frontmatter table."
        }
      }
    },
    "textMatch": {
      "type": "object",
      "additionalProperties": false,
      "required": ["path", "line", "column", "pattern-id"],
      "properties": {
        "path": { "$ref": "#/$defs/relativePath" },
        "line": {
          "type": "integer",
          "minimum": 1,
          "description": "1-based line of the match."
        },
        "column": {
          "type": "integer",
          "minimum": 1,
          "description": "1-based column of the match."
        },
        "pattern-id": {
          "type": "string",
          "minLength": 1,
          "description": "Per RFC-32 §Core entity families (v1) — stable identifier for the precomputed regex pattern that produced this match."
        }
      }
    }
  }
}
